[
  {"id":"security-hardcoded-secret-01","dimension":"security","patterns":["hardcoded-secret"],"severities":["critical","high"],"devices":["contrast"],"requires_verified_evidence":true,"tones":{"professional":"凭据被固化在受版本控制的内容中，暴露范围不再由密钥系统管理。","sharp":"密钥管理在这里被简化成了源码管理，任何副本都顺带获得凭据。","savage":"这不是配置便利性，而是把访问凭证直接纳入代码分发流程。"}},
  {"id":"security-hardcoded-secret-02","dimension":"security","patterns":["hardcoded-secret"],"severities":["high","medium"],"devices":["technical-metaphor"],"requires_verified_evidence":true,"tones":{"professional":"静态凭据使轮换和环境隔离依赖代码变更。","sharp":"凭据被焊在代码里，每次轮换都得先安排一次发布。","savage":"密钥轮换本应转动钥匙，这里却要求重新装修整扇门。"}},
  {"id":"security-command-injection-01","dimension":"security","patterns":["command-injection"],"severities":["critical","high"],"devices":["contrast"],"requires_verified_evidence":true,"tones":{"professional":"外部输入进入命令解释上下文，攻击者可改变预期执行边界。","sharp":"程序准备执行一个参数，命令解释器收到的却可能是一整套指令。","savage":"输入边界在解释器前失效，命令执行权随字符串一起交了出去。"}},
  {"id":"security-command-injection-02","dimension":"security","patterns":["command-injection"],"severities":["high","medium"],"devices":["rhetorical-question"],"requires_verified_evidence":true,"tones":{"professional":"命令参数与命令文本未保持结构化分离。","sharp":"既然参数可以改写命令结构，这里还剩下哪一层执行边界？","savage":"当数据可以自行升级成指令，参数列表就只剩形式上的秩序。"}},
  {"id":"security-sql-injection-01","dimension":"security","patterns":["sql-injection"],"severities":["critical","high"],"devices":["contrast"],"requires_verified_evidence":true,"tones":{"professional":"未参数化输入参与查询结构拼接，查询语义可被外部数据改变。","sharp":"数据库需要的是参数，这里递交的却是允许输入参与编写的查询。","savage":"查询边界没有参数化，外部数据因此获得了参与 SQL 设计的权限。"}},
  {"id":"security-sql-injection-02","dimension":"security","patterns":["sql-injection"],"severities":["high","medium"],"devices":["reversal"],"requires_verified_evidence":true,"tones":{"professional":"字符串拼接把数据值转换成了查询语法的一部分。","sharp":"本来只负责提供值的输入，在这里顺便获得了改写查询的能力。","savage":"数据没有被带进查询，它被邀请进来共同决定查询结构。"}},
  {"id":"security-unsafe-deserialization-01","dimension":"security","patterns":["unsafe-deserialization"],"severities":["critical","high"],"devices":["technical-metaphor"],"requires_verified_evidence":true,"tones":{"professional":"不受信任的数据进入可构造运行时对象的反序列化路径。","sharp":"输入不只恢复数据，还可能按自己的说明组装运行时对象。","savage":"反序列化边界接受的不是数据包，而是一份可影响对象构造的装配单。"}},
  {"id":"security-unsafe-deserialization-02","dimension":"security","patterns":["unsafe-deserialization"],"severities":["high","medium"],"devices":["contrast"],"requires_verified_evidence":true,"tones":{"professional":"反序列化能力超过了该输入场景所需的数据表达范围。","sharp":"这里只需要读取数据，却启用了能够恢复行为的完整工具箱。","savage":"需求是拆一封信，实现却开放了一条对象构造流水线。"}},
  {"id":"security-missing-validation-01","dimension":"security","patterns":["missing-validation"],"severities":["high","medium"],"devices":["deadpan"],"requires_verified_evidence":true,"tones":{"professional":"外部输入在进入敏感操作前缺少明确约束。","sharp":"输入校验采用了信任机制：调用方最好一直按预期行事。","savage":"边界没有拒绝无效输入，它选择把判断工作完整转交给后续代码。"}},
  {"id":"security-missing-validation-02","dimension":"security","patterns":["missing-validation"],"severities":["medium","low"],"devices":["rhetorical-question"],"requires_verified_evidence":true,"tones":{"professional":"输入契约没有在系统边界执行。","sharp":"如果边界不验证契约，后面的每一层要依据什么建立信任？","savage":"契约写得很明确，唯一没有收到通知的是实际入口。"}},
  {"id":"security-path-traversal-01","dimension":"security","patterns":["path-traversal"],"severities":["critical","high"],"devices":["technical-metaphor"],"requires_verified_evidence":true,"tones":{"professional":"外部路径片段可逃逸预期根目录，文件访问边界因此失效。","sharp":"根目录负责规定范围，未经约束的路径片段负责寻找出口。","savage":"文件沙箱画出了边界，但路径规范化缺口已经把侧门留在墙上。"}},
  {"id":"security-insecure-default-01","dimension":"security","patterns":["insecure-default"],"severities":["high","medium"],"devices":["reversal"],"requires_verified_evidence":true,"tones":{"professional":"默认配置在未显式覆盖时启用了更高风险行为。","sharp":"安全选项存在，只是系统默认选择不使用它。","savage":"保护机制被列入菜单，默认套餐却主动把它拿掉了。"}},
  {"id":"security-excessive-permission-01","dimension":"security","patterns":["excessive-permission"],"severities":["high","medium"],"devices":["contrast"],"requires_verified_evidence":true,"tones":{"professional":"授予的权限范围超过了当前操作实际需要。","sharp":"这项操作只需要一把钥匙，却拿到了整栋楼的门禁卡。","savage":"最小权限在这里被理解成了最少申请次数。"}},
  {"id":"security-dependency-risk-01","dimension":"security","patterns":["dependency-risk"],"severities":["high","medium","low"],"devices":["technical-metaphor"],"requires_verified_evidence":true,"tones":{"professional":"依赖版本或来源缺少足够约束，供应链结果不可稳定复现。","sharp":"构建把一部分安全边界交给了未来某次依赖解析。","savage":"依赖清单写的是名称，实际交付内容则由下一次解析临场决定。"}},
  {"id":"security-sensitive-log-01","dimension":"security","patterns":["sensitive-log"],"severities":["high","medium"],"devices":["contrast"],"requires_verified_evidence":true,"tones":{"professional":"日志记录包含超出诊断需要的敏感字段。","sharp":"日志成功保留了上下文，也顺便保留了不该进入日志的秘密。","savage":"可观测性在这里开得过于通透，敏感数据也获得了永久观众席。"}}
]
