[
  {"id":"engineering-missing-tests-01","dimension":"engineering","patterns":["missing-tests"],"severities":["medium","low","info"],"devices":["deadpan"],"requires_verified_evidence":true,"tones":{"professional":"关键行为缺少可重复执行的回归验证。","sharp":"回归测试目前非常稳定，因为它还没有覆盖这项行为。","savage":"功能拥有完整实现，验证方案则采用上线后观察。"}},
  {"id":"engineering-missing-tests-02","dimension":"engineering","patterns":["missing-tests"],"severities":["low","info"],"devices":["contrast"],"requires_verified_evidence":true,"tones":{"professional":"实现变化没有对应的自动化行为约束。","sharp":"代码负责持续变化，测试负责持续缺席。","savage":"行为可以自由演化，因为没有自动化检查负责记住原来的承诺。"}},
  {"id":"engineering-weak-tests-01","dimension":"engineering","patterns":["weak-tests"],"severities":["medium","low"],"devices":["contrast"],"requires_verified_evidence":true,"tones":{"professional":"测试执行了路径，但没有断言关键行为结果。","sharp":"测试确认代码跑过了，至于跑得对不对则保持开放。","savage":"测试完成了出勤登记，行为验证没有参加。"}},
  {"id":"engineering-weak-tests-02","dimension":"engineering","patterns":["weak-tests"],"severities":["low","info"],"devices":["rhetorical-question"],"requires_verified_evidence":true,"tones":{"professional":"断言不足以区分正确结果和错误结果。","sharp":"如果错误输出也能通过，这条测试究竟保护了什么？","savage":"红灯被拆掉以后，测试当然可以一直保持绿色。"}},
  {"id":"engineering-missing-ci-01","dimension":"engineering","patterns":["missing-ci"],"severities":["medium","low","info"],"devices":["deadpan"],"requires_verified_evidence":true,"tones":{"professional":"提交过程缺少统一执行的自动化质量门槛。","sharp":"检查流程依赖每次都有人记得完整运行所有命令。","savage":"持续集成目前主要持续依赖记忆力。"}},
  {"id":"engineering-missing-ci-02","dimension":"engineering","patterns":["missing-ci"],"severities":["low","info"],"devices":["contrast"],"requires_verified_evidence":true,"tones":{"professional":"本地验证规则没有对应的远程执行环境。","sharp":"质量标准写在文档里，合并入口并不负责执行它。","savage":"门禁规则很完整，只是门口没有安装门禁。"}},
  {"id":"engineering-documentation-drift-01","dimension":"engineering","patterns":["documentation-drift"],"severities":["medium","low"],"devices":["contrast"],"requires_verified_evidence":true,"tones":{"professional":"文档描述与当前命令、参数或行为不一致。","sharp":"实现已经抵达新版本，文档仍在介绍上一站。","savage":"代码完成了升级，说明书选择继续维护历史现场。"}},
  {"id":"engineering-documentation-drift-02","dimension":"engineering","patterns":["documentation-drift"],"severities":["low","info"],"devices":["reversal"],"requires_verified_evidence":true,"tones":{"professional":"过时说明增加了上手和排障成本。","sharp":"文档本来减少试错，现在它自己成为了第一轮试错。","savage":"上手指南没有引导路径，它提供了一条经过验证的错误路线。"}},
  {"id":"engineering-dependency-bloat-01","dimension":"engineering","patterns":["dependency-bloat"],"severities":["medium","low"],"devices":["contrast"],"requires_verified_evidence":true,"tones":{"professional":"引入的依赖能力明显超过当前使用范围。","sharp":"需求借了一把螺丝刀，依赖树送来了一整座工具仓库。","savage":"实现使用了一个函数，供应链则获得了一串完整的新成员。"}},
  {"id":"engineering-dependency-bloat-02","dimension":"engineering","patterns":["dependency-bloat"],"severities":["low","info"],"devices":["rhetorical-question"],"requires_verified_evidence":true,"tones":{"professional":"依赖成本与实际复用价值不成比例。","sharp":"为了这几行能力，完整依赖的更新和风险成本值得吗？","savage":"代码量被省下几行，维护边界则按整个依赖包结算。"}},
  {"id":"engineering-missing-lockfile-01","dimension":"engineering","patterns":["missing-lockfile"],"severities":["medium","low"],"devices":["technical-metaphor"],"requires_verified_evidence":true,"tones":{"professional":"依赖解析结果没有被锁定，构建内容可能随时间变化。","sharp":"同一份清单每次都能抽取一个略有不同的依赖组合。","savage":"构建输入写得固定，实际版本则保留了每日抽签权。"}},
  {"id":"engineering-swallowed-error-01","dimension":"engineering","patterns":["swallowed-error"],"severities":["high","medium"],"devices":["understatement"],"requires_verified_evidence":true,"tones":{"professional":"异常被捕获后既未记录、转换，也未重新抛出。","sharp":"错误处理得很彻底：连错误存在过的证据也一起处理掉了。","savage":"异常进入这里以后完成了无痕消失，调用方只收到一份虚假的平静。"}},
  {"id":"engineering-swallowed-error-02","dimension":"engineering","patterns":["swallowed-error"],"severities":["medium","low"],"devices":["reversal"],"requires_verified_evidence":true,"tones":{"professional":"捕获逻辑阻断了故障传播，却没有提供替代状态。","sharp":"这段处理阻止了异常中断，也阻止了任何一层知道发生了异常。","savage":"错误边界完成了隔离，隔离对象包括诊断信息和真实状态。"}},
  {"id":"engineering-hardcoded-config-01","dimension":"engineering","patterns":["hardcoded-config"],"severities":["medium","low"],"devices":["contrast"],"requires_verified_evidence":true,"tones":{"professional":"环境相关值被固化在实现中，部署差异需要代码变更。","sharp":"配置已经找到最稳定的位置：业务代码内部。","savage":"环境切换本应替换参数，这里安排了一次源代码发布。"}},
  {"id":"engineering-release-process-01","dimension":"engineering","patterns":["release-process"],"severities":["medium","low"],"devices":["technical-metaphor"],"requires_verified_evidence":true,"tones":{"professional":"发布步骤依赖未记录或不可重复的人工操作。","sharp":"发布流程拥有多个人工路口，却没有一张可重放的路线图。","savage":"每次发布都是一次现场演出，成功经验很难自动参加下一场。"}},
  {"id":"engineering-poor-commit-history-01","dimension":"engineering","patterns":["poor-commit-history"],"severities":["low","info"],"devices":["deadpan"],"requires_verified_evidence":true,"tones":{"professional":"提交信息不足以解释变更目的和范围。","sharp":"提交历史完整记录了发生过修改，至于为什么则保持神秘。","savage":"版本历史保存了每一步脚印，同时删除了所有路标。"}},
  {"id":"engineering-onboarding-friction-01","dimension":"engineering","patterns":["onboarding-friction"],"severities":["medium","low"],"devices":["technical-metaphor"],"requires_verified_evidence":true,"tones":{"professional":"从获取代码到完成首次运行需要依赖未记录知识。","sharp":"上手路径没有入口说明，只提供了一系列需要自行发现的隐藏关卡。","savage":"项目可以运行，前提是先完成一场关于本地约定的考古。"}},
  {"id":"engineering-onboarding-friction-02","dimension":"engineering","patterns":["onboarding-friction"],"severities":["low","info"],"devices":["rhetorical-question"],"requires_verified_evidence":true,"tones":{"professional":"关键准备步骤没有出现在可发现的入口文档中。","sharp":"如果首次运行必须靠口头补充，仓库本身提供了多少上手信息？","savage":"README 负责欢迎，真正的安装流程则躲在仓库外等待被询问。"}},
  {"id":"engineering-missing-changelog-01","dimension":"engineering","patterns":["missing-changelog"],"severities":["low","info"],"devices":["contrast"],"requires_verified_evidence":true,"tones":{"professional":"发布版本缺少面向使用者的行为变化记录。","sharp":"版本号持续前进，变化说明选择留白。","savage":"发布带来了新版本，至于带来了什么则交给使用过程揭晓。"}},
  {"id":"engineering-release-process-02","dimension":"engineering","patterns":["release-process"],"severities":["low","info"],"devices":["rhetorical-question"],"requires_verified_evidence":true,"tones":{"professional":"版本、标签和发布产物之间缺少一致的对应规则。","sharp":"当标签、版本和产物不一致时，哪一个才代表这次发布？","savage":"发布拥有三个版本事实来源，每一个都保留最终解释权。"}}
]
