[
  {"id":"readability-vague-naming-01","dimension":"readability","patterns":["vague-naming"],"severities":["medium","low"],"devices":["deadpan"],"requires_verified_evidence":true,"tones":{"professional":"名称没有表达值在当前业务中的角色。","sharp":"这个变量名提供了一个重要信息：它确实装着某种数据。","savage":"名称成功避免了误导，办法是不提供任何有效方向。"}},
  {"id":"readability-vague-naming-02","dimension":"readability","patterns":["vague-naming"],"severities":["low","info"],"devices":["rhetorical-question"],"requires_verified_evidence":true,"tones":{"professional":"通用名称增加了理解上下文所需的跳转。","sharp":"如果所有结果都叫 result，读者要靠什么区分它们？","savage":"变量统一获得了匿名身份，具体含义全部留给调用现场猜测。"}},
  {"id":"readability-long-function-01","dimension":"readability","patterns":["long-function"],"severities":["high","medium"],"devices":["analogy"],"requires_verified_evidence":true,"tones":{"professional":"函数同时包含多个可以独立命名的处理阶段。","sharp":"这个函数不是一个步骤，是一整条没有站名的流水线。","savage":"从入口到返回值是一趟直达长途，途中所有职责都被塞进同一节车厢。"}},
  {"id":"readability-long-function-02","dimension":"readability","patterns":["long-function"],"severities":["medium","low"],"devices":["rhetorical-question"],"requires_verified_evidence":true,"tones":{"professional":"多个抽象层级集中在同一函数内。","sharp":"当一个函数需要负责读取、判断、转换和写入，它的名字还能准确概括什么？","savage":"函数名只有一行，职责清单却已经扩展成了目录。"}},
  {"id":"readability-deep-nesting-01","dimension":"readability","patterns":["deep-nesting"],"severities":["medium","low"],"devices":["technical-metaphor"],"requires_verified_evidence":true,"tones":{"professional":"多层条件嵌套增加了路径跟踪成本。","sharp":"每深入一层条件，主流程就离左边界更远一步。","savage":"业务路径在缩进里持续下潜，返回地面需要完整保存沿途地图。"}},
  {"id":"readability-deep-nesting-02","dimension":"readability","patterns":["deep-nesting"],"severities":["medium","low"],"devices":["reversal"],"requires_verified_evidence":true,"tones":{"professional":"控制流结构遮挡了函数的主要行为。","sharp":"条件分支本来解释例外，现在主流程反而成了最深处的隐藏内容。","savage":"缩进负责组织逻辑，最后成功把核心路径组织到了视线之外。"}},
  {"id":"readability-mixed-abstraction-level-01","dimension":"readability","patterns":["mixed-abstraction-level"],"severities":["medium","low"],"devices":["contrast"],"requires_verified_evidence":true,"tones":{"professional":"函数在流程编排和底层数据操作之间频繁切换。","sharp":"上一行还在安排业务流程，下一行已经开始手工处理字节细节。","savage":"这段函数同时担任指挥台和螺丝刀，视角切换完全不设过渡。"}},
  {"id":"readability-mixed-abstraction-level-02","dimension":"readability","patterns":["mixed-abstraction-level"],"severities":["low","info"],"devices":["technical-metaphor"],"requires_verified_evidence":true,"tones":{"professional":"相邻语句工作在不同抽象层级。","sharp":"读者刚看清全局路线，就被拉去检查一个局部零件。","savage":"代码在卫星视角和显微镜视角之间反复切换，没有提供变焦过程。"}},
  {"id":"readability-misleading-comment-01","dimension":"readability","patterns":["misleading-comment"],"severities":["high","medium","low"],"devices":["contrast"],"requires_verified_evidence":true,"tones":{"professional":"注释描述的行为与当前实现不一致。","sharp":"代码已经改变方向，注释仍在认真介绍旧路线。","savage":"实现完成了迁移，注释选择留在原地继续担任错误路标。"}},
  {"id":"readability-misleading-comment-02","dimension":"readability","patterns":["misleading-comment"],"severities":["medium","low"],"devices":["reversal"],"requires_verified_evidence":true,"tones":{"professional":"该注释增加了与实现冲突的信息。","sharp":"注释本来减少理解成本，现在需要先被识别为不可信信息。","savage":"这段说明没有解释代码，它额外提供了一条需要排除的错误线索。"}},
  {"id":"readability-duplicated-branch-01","dimension":"readability","patterns":["duplicated-branch"],"severities":["medium","low"],"devices":["rhetorical-question"],"requires_verified_evidence":true,"tones":{"professional":"多个条件分支执行相同或近似逻辑。","sharp":"既然分支最终做同一件事，这个条件究竟隔离了什么？","savage":"条件树枝繁叶茂，所有枝条最后结出了同一个结果。"}},
  {"id":"readability-duplicated-branch-02","dimension":"readability","patterns":["duplicated-branch"],"severities":["low","info"],"devices":["deadpan"],"requires_verified_evidence":true,"tones":{"professional":"重复分支使行为差异难以辨认。","sharp":"这些分支保持了高度一致，一致到可以不必分开存在。","savage":"控制流提供了多项选择，执行结果则坚持单一套餐。"}},
  {"id":"readability-magic-number-01","dimension":"readability","patterns":["magic-number"],"severities":["medium","low"],"devices":["deadpan"],"requires_verified_evidence":true,"tones":{"professional":"字面量没有表达其业务含义或单位。","sharp":"这个数字知道自己为什么是这个值，代码没有替它说明。","savage":"常量把含义藏得很稳，只留下一个数字要求后续自行考古。"}},
  {"id":"readability-magic-number-02","dimension":"readability","patterns":["magic-number"],"severities":["low","info"],"devices":["rhetorical-question"],"requires_verified_evidence":true,"tones":{"professional":"重复字面量缺少统一命名。","sharp":"当这个值需要调整时，哪些相同数字属于同一条规则？","savage":"数字复制得很整齐，修改时却没有携带任何亲属关系证明。"}},
  {"id":"readability-boolean-parameter-01","dimension":"readability","patterns":["boolean-parameter"],"severities":["medium","low"],"devices":["contrast"],"requires_verified_evidence":true,"tones":{"professional":"布尔实参无法在调用点表达所选择的行为。","sharp":"调用点写得很简短，`true` 究竟开启什么则需要跳进实现确认。","savage":"一个布尔值压缩了字符数量，也顺便压缩掉了行为说明。"}},
  {"id":"readability-boolean-parameter-02","dimension":"readability","patterns":["boolean-parameter"],"severities":["low","info"],"devices":["rhetorical-question"],"requires_verified_evidence":true,"tones":{"professional":"多个布尔参数使调用语义依赖参数顺序。","sharp":"面对 `true, false`，哪一个控制缓存，哪一个控制校验？","savage":"调用只提供真假排列，具体业务含义需要读者现场解码。"}},
  {"id":"readability-inconsistent-style-01","dimension":"readability","patterns":["inconsistent-style"],"severities":["low","info"],"devices":["contrast"],"requires_verified_evidence":true,"tones":{"professional":"同一作用域使用了不一致的命名或结构约定。","sharp":"代码共享一个文件，却没有共享同一套表达习惯。","savage":"风格指南在这里采用了多方言并行策略。"}},
  {"id":"readability-dead-code-01","dimension":"readability","patterns":["dead-code"],"severities":["medium","low","info"],"devices":["deadpan"],"requires_verified_evidence":true,"tones":{"professional":"不可达或无调用代码增加了有效行为的辨识成本。","sharp":"这段代码保持着完整实现，唯一缺少的是执行机会。","savage":"功能已经永久休假，维护成本仍按全职标准留在仓库。"}},
  {"id":"readability-dead-code-02","dimension":"readability","patterns":["dead-code"],"severities":["low","info"],"devices":["rhetorical-question"],"requires_verified_evidence":true,"tones":{"professional":"无消费者的实现使当前支持范围变得含糊。","sharp":"既然没有路径会到达这里，这段实现还在保护哪项行为？","savage":"代码为一个不存在的调用方持续提供着周到服务。"}},
  {"id":"readability-excessive-indirection-01","dimension":"readability","patterns":["excessive-indirection"],"severities":["medium","low"],"devices":["technical-metaphor"],"requires_verified_evidence":true,"tones":{"professional":"理解单一行为需要跨越过多只做转发的层级。","sharp":"逻辑没有被隐藏，只是被分散到一条需要多次换乘的路线。","savage":"每一层都几乎什么也不做，合在一起却成功让追踪路径变得很忙。"}}
]
