[
  {"id":"performance-n-plus-one-01","dimension":"performance","patterns":["n-plus-one"],"severities":["high","medium"],"devices":["contrast"],"requires_verified_evidence":true,"tones":{"professional":"批量数据处理被实现为循环内逐项查询。","sharp":"数据库不会因为变量名叫 batch，就自动替这段循环完成批处理。","savage":"批量需求到了这里，被拆成了一张按元素结算的查询账单。"}},
  {"id":"performance-n-plus-one-02","dimension":"performance","patterns":["n-plus-one"],"severities":["medium","low"],"devices":["technical-metaphor"],"requires_verified_evidence":true,"tones":{"professional":"查询次数随结果数量线性增长。","sharp":"每多一条结果，数据库就会收到一张新的工作单。","savage":"结果集负责增长，查询数量负责一比一陪跑。"}},
  {"id":"performance-quadratic-loop-01","dimension":"performance","patterns":["quadratic-loop"],"severities":["high","medium"],"devices":["technical-metaphor"],"requires_verified_evidence":true,"tones":{"professional":"嵌套遍历使工作量随输入规模平方增长。","sharp":"数据每增长一圈，这段循环就给自己增加一整排对手。","savage":"输入规模负责加法，执行成本坚持用平方作答。"}},
  {"id":"performance-quadratic-loop-02","dimension":"performance","patterns":["quadratic-loop"],"severities":["medium","low"],"devices":["rhetorical-question"],"requires_verified_evidence":true,"tones":{"professional":"重复扫描同一集合造成不必要的二次复杂度。","sharp":"既然可以建立索引，为什么每个元素都要重新认识整份列表？","savage":"集合没有索引，于是每个成员都被安排了一次全员见面会。"}},
  {"id":"performance-blocking-io-01","dimension":"performance","patterns":["blocking-io"],"severities":["high","medium"],"devices":["contrast"],"requires_verified_evidence":true,"tones":{"professional":"同步 I/O 阻塞了需要保持可调度的执行路径。","sharp":"并发入口已经准备好接待请求，同步 I/O 要求所有请求先排队。","savage":"异步框架铺好了多车道，这次同步调用随后放下了单行道闸。"}},
  {"id":"performance-blocking-io-02","dimension":"performance","patterns":["blocking-io"],"severities":["medium","low"],"devices":["deadpan"],"requires_verified_evidence":true,"tones":{"professional":"等待外部资源时执行线程无法处理其他工作。","sharp":"这段等待非常专注，专注到同一线程不能顺便处理任何事情。","savage":"资源还没回来，执行线程已经决定原地陪它等到底。"}},
  {"id":"performance-repeated-computation-01","dimension":"performance","patterns":["repeated-computation"],"severities":["medium","low"],"devices":["deadpan"],"requires_verified_evidence":true,"tones":{"professional":"相同输入在同一路径中被重复计算。","sharp":"结果没有变化，计算过程倒是获得了多次完整演出。","savage":"这段逻辑对第一次结果缺乏信任，于是原样重新算了一遍。"}},
  {"id":"performance-repeated-computation-02","dimension":"performance","patterns":["repeated-computation"],"severities":["medium","low","info"],"devices":["rhetorical-question"],"requires_verified_evidence":true,"tones":{"professional":"稳定结果未在当前作用域复用。","sharp":"既然输入没有变化，第二次计算准备发现什么新消息？","savage":"相同问题被连续提问，代码显然期待数学在下一行改变答案。"}},
  {"id":"performance-resource-leak-01","dimension":"performance","patterns":["resource-leak"],"severities":["critical","high","medium"],"devices":["technical-metaphor"],"requires_verified_evidence":true,"tones":{"professional":"资源在部分退出路径上未被释放，使用量会随执行累积。","sharp":"资源入口有登记，异常出口却没有办理离场。","savage":"每次执行都可能留下资源占位，系统容量因此只出不进。"}},
  {"id":"performance-resource-leak-02","dimension":"performance","patterns":["resource-leak"],"severities":["medium","low"],"devices":["contrast"],"requires_verified_evidence":true,"tones":{"professional":"正常路径释放资源，但错误路径缺少同等清理。","sharp":"成功路径负责善后，错误路径负责把现场完整保留。","savage":"清理逻辑只服务顺利情况，真正需要它的异常路径反而免检。"}},
  {"id":"performance-unbounded-cache-01","dimension":"performance","patterns":["unbounded-cache"],"severities":["high","medium"],"devices":["reversal"],"requires_verified_evidence":true,"tones":{"professional":"缓存没有容量或淘汰边界，内存占用可随键空间持续增长。","sharp":"缓存本来节省时间，现在开始无限期收藏每一个结果。","savage":"它解决了重复计算，并用没有上限的内存账单完成结算。"}},
  {"id":"performance-unnecessary-serialization-01","dimension":"performance","patterns":["unnecessary-serialization"],"severities":["medium","low"],"devices":["technical-metaphor"],"requires_verified_evidence":true,"tones":{"professional":"数据在同一进程路径中进行了不必要的序列化往返。","sharp":"对象为了走到隔壁，先被打包、寄出，再原地拆箱。","savage":"一次内存内传递被办成了完整的出入境流程。"}},
  {"id":"performance-sequential-independent-io-01","dimension":"performance","patterns":["sequential-independent-io"],"severities":["high","medium","low"],"devices":["contrast"],"requires_verified_evidence":true,"tones":{"professional":"相互独立的 I/O 被串行等待，端到端延迟因此累加。","sharp":"这些请求彼此没有依赖，却被安排成一个接一个进场。","savage":"并行条件全部具备，执行顺序仍坚持排成单人纵队。"}},
  {"id":"performance-oversized-bundle-01","dimension":"performance","patterns":["oversized-bundle"],"severities":["medium","low"],"devices":["contrast"],"requires_verified_evidence":true,"tones":{"professional":"交付包包含当前入口不需要的代码或资源。","sharp":"页面只点了一份功能，下载包把整张菜单一起端了上来。","savage":"首屏需求很克制，构建产物则坚持全家桶出席。"}},
  {"id":"performance-missing-pagination-01","dimension":"performance","patterns":["missing-pagination"],"severities":["high","medium"],"devices":["rhetorical-question"],"requires_verified_evidence":true,"tones":{"professional":"读取路径没有限制单次结果规模。","sharp":"当数据继续增长，这次全量读取准备在哪个规模停止？","savage":"接口没有分页，因为它选择把数据规模问题一次性全部交付。"}}
]
